heading,data
"NASA’s Artemis II Mission: Preparations Underway for 2024 Launch","NASA is ramping up its efforts for the Artemis II mission, scheduled to launch in 2024. This mission will be the first crewed mission to fly around the Moon in over 50 years, paving the way for future lunar exploration. The crew, consisting of four astronauts, will perform critical tests to ensure safety for the eventual landing on the lunar surface."
"World Health Organization Declares New Pandemic Threat Level Amid Rising Cases of H5N8 Avian Flu","The World Health Organization (WHO) has raised the threat level of the H5N8 avian flu, which has been spreading across several countries. This highly contagious strain of the flu poses a significant risk to both humans and poultry industries worldwide."
"Apple Announces 2024 iPhone Release Date with Exciting New Features","Apple has officially announced the release date for the 2024 iPhone. The new model, set to launch in September, promises significant upgrades, including a faster A18 chip, a 10x optical zoom camera, and enhanced battery life."
"Olympics 2024: Paris Gets Ready to Host the Summer Games","Paris is set to host the 2024 Summer Olympics, and preparations are in full swing. The city is unveiling new sports venues and state-of-the-art facilities to ensure the Games run smoothly. This will be the first time since 1924 that Paris has hosted the Olympics."
"Artificial Intelligence Advancements: GPT-5 Rumored for Late 2024 Release","Speculation is rife about the release of GPT-5, the next iteration of OpenAI's groundbreaking language model. Expected to debut in late 2024, GPT-5 is rumored to have even more advanced natural language processing capabilities, making AI interactions even more human-like."
"Global Food Prices Soar to Record Highs Amid Ongoing Supply Chain Disruptions","Global food prices have reached record levels due to ongoing disruptions in supply chains, exacerbated by climate change and geopolitical tensions. Economists warn that this could lead to further inflation and economic instability in several countries."
"Tesla Unveils 2024 Cybertruck: The Future of Electric Vehicles","Tesla has officially unveiled its 2024 Cybertruck, featuring a new design and improved performance metrics. The electric truck, set for release in early 2024, boasts increased range, faster acceleration, and enhanced durability compared to its predecessors."
"New Discoveries in Space: Evidence of Water Found on Mars","NASA's Perseverance rover has uncovered compelling evidence of ancient water flows on Mars, further supporting the theory that the Red Planet may have once hosted life. This discovery is considered a significant milestone in space exploration."
"Climate Change: 2024 Set to Be the Hottest Year on Record","Climate scientists predict that 2024 will be the hottest year on record, driven by rising global temperatures and the continued emission of greenhouse gases. The impacts are expected to be particularly severe in vulnerable regions already suffering from droughts and wildfires."
"India’s Chandrayaan-4 Mission: Moon Landing Expected by End of 2024","India's space agency ISRO is preparing for its Chandrayaan-4 mission, which is expected to land on the Moon by the end of 2024. The mission aims to explore the lunar south pole, where scientists believe there could be significant deposits of water ice."
"UK Elections 2024: Polls Predict Tight Race Between Major Parties","As the United Kingdom prepares for its 2024 general elections, polls suggest a tight race between the ruling Conservative Party and the opposition Labour Party. Key issues such as the economy, healthcare, and climate policy are expected to dominate the political discourse."
"Meta to Launch Virtual Reality Social Platform in 2024","Meta, formerly known as Facebook, has announced plans to launch a new virtual reality social platform in 2024. The platform, which integrates with Meta’s existing VR hardware, aims to revolutionize how users interact and socialize in digital spaces."
"World Economic Forum 2024: Focus on Sustainable Development","The 2024 World Economic Forum, held in Davos, Switzerland, will focus on sustainable development and green technologies. Leaders from around the globe will discuss strategies to combat climate change, reduce inequality, and promote economic growth."
"Breakthrough in Cancer Treatment: New Drug Shows Promising Results in Trials","A new drug developed for cancer treatment has shown promising results in early trials. The medication targets aggressive tumors and has been hailed as a potential game-changer in oncology, offering hope to millions of patients worldwide."
"Elon Musk’s SpaceX to Launch Mars Colonization Mission in 2024","SpaceX, led by Elon Musk, is preparing to launch its first colonization mission to Mars in late 2024. The mission will test the feasibility of long-term human habitation on the Red Planet, marking a significant step toward interplanetary exploration."
"UN Climate Summit 2024: World Leaders Pledge to Reduce Carbon Emissions","At the 2024 UN Climate Summit, world leaders have pledged to take more aggressive action to reduce carbon emissions. The summit resulted in commitments to increase the use of renewable energy and to phase out fossil fuels by 2050."
"Global Electric Car Sales Surge in 2024 Amid Green Energy Push","Electric vehicle sales have surged globally in 2024, driven by government incentives and a growing shift toward renewable energy. Automakers like Tesla, Rivian, and Volkswagen are reporting record sales as consumers embrace eco-friendly alternatives."
"India to Overtake China as World's Most Populous Country by Mid-2024","According to United Nations projections, India is set to surpass China as the world's most populous country by mid-2024. This demographic shift is expected to have wide-ranging implications for both countries’ economies and global influence."
"World Cup 2024: Host Country Preparations in Full Swing","Preparations for the 2024 FIFA World Cup are in full swing as the host nation gears up for the global football spectacle. New stadiums are being constructed, and infrastructure is being upgraded to accommodate the influx of international fans."
"Scientists Create First Lab-Grown Human Organs for Transplant","In a groundbreaking medical development, scientists have successfully created human organs in the lab for transplant purposes. These organs, grown from stem cells, could revolutionize the field of organ transplantation and save countless lives."
"World Bank Predicts Slower Global Growth in 2024","The World Bank has predicted slower global economic growth in 2024, citing rising inflation, geopolitical tensions, and the lingering effects of the COVID-19 pandemic. Policymakers are being urged to take action to stabilize economies."
"Japan’s Population Decline Accelerates as Birth Rates Hit Record Lows","Japan is facing an unprecedented population decline as birth rates continue to plummet to record lows. The government is implementing various measures to encourage family growth, but experts warn that the demographic crisis could lead to long-term economic challenges."
"Global Chip Shortage to Continue Through 2024, Experts Say","Experts warn that the global semiconductor chip shortage, which has disrupted industries from automobiles to electronics, is likely to persist through 2024. Efforts to increase production capacity have been hampered by supply chain issues and geopolitical factors."
"Cryptocurrency Regulation Tightens Worldwide in 2024","Governments around the world are tightening regulations on cryptocurrency trading and mining in 2024. Concerns over money laundering, environmental impact, and financial instability have prompted nations like the US, EU, and China to implement stricter controls."
"Breakthrough in Renewable Energy: Scientists Develop More Efficient Solar Panels","Scientists have developed a new generation of solar panels that are significantly more efficient than previous models. These panels could drastically reduce the cost of renewable energy and accelerate the global shift away from fossil fuels."
"Healthcare Advances: Gene Editing Technology Could Cure Genetic Diseases by 2024","Researchers are optimistic that advances in gene editing technology could lead to cures for genetic diseases by 2024. This breakthrough offers hope to millions of people suffering from inherited conditions like cystic fibrosis and sickle cell anemia."
"World Hunger on the Rise as Global Crises Intensify","The number of people facing hunger has risen dramatically in 2024 due to a combination of climate change, conflicts, and economic instability. International organizations are calling for urgent action to address food insecurity in vulnerable regions."
"China and US Begin Trade Talks to Ease Economic Tensions in 2024","China and the United States have begun trade negotiations in 2024 to ease economic tensions that have strained relations between the two superpowers. Both sides are seeking to resolve issues related to tariffs, intellectual property, and market access."
"Amazon Launches Drone Delivery Service in Major US Cities in 2024","Amazon has launched its much-anticipated drone delivery service in several major US cities. The service aims to deliver packages in under 30 minutes, revolutionizing the way consumers receive goods and marking a new era in e-commerce."
"Global Water Crisis: UN Warns of Severe Shortages by 2024","The United Nations has issued a stark warning that the world is facing a severe water crisis by 2024, with billions of people at risk of shortages. The report highlights the urgent need for improved water management and conservation efforts."
